{
  "$schema": "https://json-schema.org/draft/2020-12/schema",
  "$id": "https://folio.local/schemas/types/loop-flywheel.schema.json",
  "title": "Folio Loop Flywheel Authoring Input",
  "type": "object",
  "additionalProperties": false,
  "required": [
    "schema_version",
    "kind",
    "title",
    "stages"
  ],
  "allOf": [{"if":{"properties":{"canvas":{"const":"poster"}},"required":["canvas"]},"else":{"properties":{"height":{"maximum":800}}}}],
  "properties": {
    "schema_version": {
      "const": "3.0"
    },
    "kind": {
      "const": "loop-flywheel"
    },
    "title": {
      "$ref": "#/$defs/non-empty-string"
    },
    "hub": {"$ref": "#/$defs/nullable-string"},
    "stages": {
      "type": "array",
      "minItems": 3,
      "maxItems": 6,
      "items": {
        "$ref": "#/$defs/stage"
      }
    },
    "focus": {"$ref": "#/$defs/nullable-string"},
    "canvas": {"enum": ["figure", "poster"]},
    "width": {
      "const": 960
    },
    "height": {
      "type": "integer",
      "minimum": 500,
      "maximum": 4000,
      "multipleOf": 4
    },
    "language": {"$ref": "#/$defs/nullable-string"}
  },
  "$defs": {
    "nullable-string": {"oneOf": [{"type": "null"}, {"$ref": "#/$defs/non-empty-string"}]},
    "non-empty-string": {
      "type": "string",
      "pattern": ".*\\S.*"
    },
    "stage": {
      "type": "object",
      "additionalProperties": false,
      "required": [
        "id",
        "label"
      ],
      "properties": {
        "id": {
          "$ref": "#/$defs/non-empty-string"
        },
        "label": {
          "$ref": "#/$defs/non-empty-string"
        },
        "detail": {
          "$ref": "#/$defs/non-empty-string"
        },
        "emphasis": {
          "enum": [
            "focal",
            "normal"
          ]
        }
      }
    }
  }
}
